dataset_id;Federated dataset;Title;Description;Themes;Keywords;License;Language;Timezone;Modified;Data processed;Metadata processed;Publisher;Reference;Attributions;Created;Issued;Creator;Contributor;Contact name;Contact email;Accrual periodicity;Spatial;Temporal;Granularity;Data quality;Publisher type;Cycle de publication;Périodicité de mise à jour;Number of records;Published;Statut de publication
accidents-passagers;False;Accidents passagers depuis 2008;Le jeu de données a pour objectif de donner le nombre de circulations ayant un accident. Cette information est donnée sur une échelle de gravité à 3 niveaux : accidents avec tués / accidents avec blessés graves / accidents avec blessés légers.  Définitions : Tué : toute personne se trouvant dans le train, tuée sur le coup ou décédant dans les 30 jours.  Blessé grave : toute personne se trouvant dans le train, qui a été hospitalisée pendant plus de 24 heures.  Blessé léger : toute personne se trouvant dans le train, dont la durée de l’hospitalisation est inférieure à 24 heures ou toute personne ayant fait une déclaration de blessure, même s’il n’y a pas eu hospitalisation.  Ces données sont issues du Rapport annuel Sécurité de l'exploitation sur le réseau ferré national français. Publié chaque année, ce rapport dresse le bilan des activités sécurité de l’entreprise et répond à l’obligation d’information faite à SNCF selon les termes de l’article 17 du décret n° 2006- 1279.;Sécurité ferroviaire;Sécurité,Accidents,Sécurité & Qualité de Service Ferroviaire;Open Database License (ODbL);fr;;2023-06-28;2023-06-28;2023-06-28;SNCF;;;;2014-07-24;;;;;Annuelle;;Depuis 2008;;;;;Annuelle;45;True;En retard
accompagnement-pmr-gares;False;Accompagnement de personnes à mobilité réduite dans les gares;Ces données fournissent le nombre d'accompagnements de personnes à mobilité réduite dans les gares depuis 2015.;Gares,Services voyageurs;Accessibilité,Gare de voyageurs;Open Database License (ODbL);fr;;2022-03-23;2022-03-23;2022-03-23;Gares & Connexions;;;2015-02-17;2015-02-17;;;;;Mensuelle;;Depuis 2015;Par accompagnement;;;;Mensuelle;51861;True;En retard
accords-collectifs;False;Accords collectifs nationaux;Accords collectifs nationaux visant à mettre en place des politiques sociales communes à l’ensemble des salariés du Groupe public ferroviaire (SNCF).  Ce jeu de données traduit la mise en place de l’unité sociale du Groupe public ferroviaire en 2015. Le dialogue social soutenu avec les organisations syndicales s’est concrétisé par la signature de 22 accords collectifs nationaux.  La grande majorité des accords a permis de mettre en place des politiques sociales communes à l’ensemble des salariés du GPF (SNCF, SNCF Réseau, SNCF Mobilités) en matière d’égalité professionnelle entre les femmes et les hommes et la mixité, l’amélioration de la politique d’aide au logement, les actions en faveur de l’emploi des travailleurs handicapés, une protection sociale renforcée pour les contractuels.   Certains accords ont permis d’introduire  des dispositions novatrices comme l’intéressement  au sein de SNCF Réseau et de SNCF Mobilités qui reconnaissent et associent les salariés au résultat de chacun de ces deux EPIC. De même, le Groupe public ferroviaire a mis en place un plan épargne de groupe, ainsi qu'un compte épargne temps avec des possibilités de le monétiser donnant ainsi plus de marges de manœuvres aux salariés.  Des dispositifs sont également mis en place à l’échelle du Groupe SNCF. Ainsi une bourse de l’emploi et une charte de mobilité signée par les sociétés du groupe, favorisent des mobilités plus larges et plus diversifiées à l’ensemble des collaborateurs.;Social et ressources humaines;Social,Salariés,Organisations syndicales,Direction Cohésion;Open Database License (ODbL);fr;;2017-04-13;2017-04-13;2021-03-30;SNCF;;;;2016-03-03;;;;;Sur évènement;;Depuis 2015;SNCF;;;;Irrégulière;22;True;
agents-repos-dimanche;False;Agents SNCF ayant leur repos le dimanche;"Nombre d'agents SNCF ayant leur repos le dimanche. ""Collège"" : classification selon les collèges de représentation du personnel, à savoir ""exécution"", ""maîtrise"" et ""cadre"".""Alinéa A"" : personnels de directions centrales et régionales, à l'exception des personnels affectés dans des entités opérationnelles (postes de commandement et surveillance générale par exemple) qui relèvent des alinéas B et C.""Alinéa B"" : personnels des établissements et des entités opérationnelles visés à l’alinéa A mais qui ne sont pas soumis aux contraintes particulières qui justifient le mode de répartition visé à l’alinéa C.""Alinéa C"" : personnels et emplois des établissements et des entités opérationnelles visées à l’alinéa A qui sont soumis à des cycles de roulement. Ces données sont issues du Bilan social publié chaque année par la Direction cohésion & ressources humaines de SNCF. Le bilan social présente les données relatives à l’ensemble du personnel de l’entreprise à l’exception des médecins qui interviennent dans le cadre de la médecine du travail et de la médecine de soins des agents en activité, des stagiaires, des concierges et du personnel contractuel sous contrait aidé.  

  A partir de 2019, le type d’effectif prise en compte par
le Bilan Social a été modifié : les effectifs présentés sont les effectifs
totaux ( et non plus les effectifs « réels).";Social et ressources humaines;Social,Ressources humaines,Conditions de travail,Direction Cohésion;Open Database License (ODbL);fr;;2024-03-18;2024-03-18;2024-03-18;SNCF;;;;;Direction cohésion & ressources humaines;;;;Annuelle;;Depuis 2010;;;;;Annuelle;78;True;
agents-nationalite-etrangere;False;Agents SNCF de nationalité étrangère;"Agents de nationalité étrangère au 31 décembre depuis 2010. ""Collège"" : classification selon les collèges de représentation du personnel, à savoir “exécution”, “maîtrise” et “cadre”.“Agents au statut” : également désigné par “cadre permanent” à l’intérieur de SNCF, cette notion désigne une position statutaire, quelque soit le collège de l’agent, conforme aux dispositions de la directive interne RH 001 (“Statut des relations collectives entre la SNCF et son personnel”).""Agents contractuels"" : désigne un agent qui n’est pas au statut, mais et qui est lié à SNCF par un contrat de travail de droit commun.Le personnel roulant comprend les agents de conduite (« exécution roulants conduite ») et les chefs de bord (“exécution roulants trains »). Ces données sont issues du Bilan social publié chaque année par la Direction cohésion & ressources humaines de SNCF. Le bilan social présente les données relatives à l’ensemble du personnel de l’entreprise à l’exception des médecins qui interviennent dans le cadre de la médecine du travail et de la médecine de soins des agents en activité, des stagiaires, des concierges et du personnel contractuel sous contrait aidé.  

  A partir de 2019, le type d’effectif prise en compte par
le Bilan Social a été modifié : les effectifs présentés sont les effectifs
totaux ( et non plus les effectifs « réels).";Social et ressources humaines;Social,Ressources humaines,Direction Cohésion;Open Database License (ODbL);fr;;2023-01-03;2023-01-03;2023-01-03;SNCF;;;2014-07-07;;Direction cohésion & ressources humaines;;;;Annuelle;;Depuis 2010;;;;;Annuelle;120;True;En retard
agents-situation-handicap;False;Agents SNCF en situation de handicap;"Agents SNCF en situation de handicap et en service au 31 décembre depuis 2010.  *Suite à la réforme ferroviaire, le jeu de données prend en compte les agents en situation de handicap par EPIC, sans distinction de statut. “Agents au statut” : également désigné par “cadre permanent” à l’intérieur de SNCF, cette notion désigne une position statutaire, quelque soit le collège de l’agent, conforme aux dispositions de la directive interne RH 001 (“Statut des relations collectives entre la SNCF et son personnel”).""Agents contractuels"" : désigne un agent qui n’est pas au statut, mais et qui est lié à SNCF par un contrat de travail de droit commun.   En application de la loi n° 2005 – 102 du 11 février 2005 pour l'égalité des droits et des chances, la participation et la citoyenneté des personnes handicapées, notamment les dispositions relatives au calcul de l’obligation d’emploi des travailleurs handicapés, le nombre d’unités déclaratives repris dans cet indicateur correspond au prorata des agents reconnus travailleurs de l’Épic SNCF, selon les trois critères suivants : temps de présence en entreprise, temps de travail et durée de la validité de la reconnaissance travailleur handicapé.   Ces données sont issues du Bilan social publié chaque année par la Direction cohésion & ressources humaines de SNCF. Le bilan social présente les données relatives à l’ensemble du personnel de l’entreprise à l’exception des médecins qui interviennent dans le cadre de la médecine du travail et de la médecine de soins des agents en activité, des stagiaires, des concierges et du personnel contractuel sous contrait aidé.  

  

  A partir de 2019, le type d’effectif prise en compte par
le Bilan Social a été modifié : les effectifs présentés sont les effectifs
totaux ( et non plus les effectifs « réels).";Social et ressources humaines;Social,Ressources humaines,Direction Cohésion;Open Database License (ODbL);fr;;2024-03-18;2024-03-18;2024-03-18;SNCF;;;2014-07-07;;Direction cohésion & ressources humaines;;;;Annuelle;;Depuis 2010;;;;;Annuelle;13;True;
api-navitia-io;False;API Navitia.io;Navitia.io est une API qui vous permet d'ajouter plusieurs services dans vos applications d'information voyageur.  Jouez avec les données de transport de plusieurs réseaux dans le monde (Île-de-France, Sa Francisco, Berlin, Nantes, NYC, Pays-Bas, etc.) et profitez de plusieurs services avec cette API :  calcul des itinérairesexploration des donnéesisochronesprochains départsfiches horaires Adresse de l'API : http://navitia.io/;Horaires et itinéraires;Horaire,Calcul d'itinéraire,API,Monde;Plusieurs licences;fr;;2021-04-06;;2021-04-06;SNCF Voyageurs;;;;2013-01-23;;;;;;http://navitia.io/;;;;;;;0;True;
api-temps-reel-transilien-old;False;API temps réel Transilien;"API donnant accès aux prochains départs pour une gare donnée du réseau SNCF Transilien. 
	Le nombre d'appels est actuellement limité à 20 appels/minutes. Pour obtenir des identifiants d'accès à l'API, merci de faire votre 
	demande par mail. 
	Accédez au 
	guide d'utilisation de l'API Temps réel Transilien.  
	Adresse de l'API : 
	https://api.transilien.com";Horaires et itinéraires;Horaire,API,Ile-de-France,Transilien;Open Database License (ODbL);fr;;2021-03-30;;2024-01-10;SNCF Voyageurs;;;;2012-07-04;Transilien;;;;;https://api.transilien.com;Temps réel;Gare et train Transilien;;;;;0;True;
api-sncf;False;API théorique et temps réel;Accédez aux horaires planifiés et temps réel des trains SNCF ainsi qu'au moteur de calcul d'itinéraire.  L'API SNCF est accessible sur https://numerique.sncf.com/startup/api/;Horaires et itinéraires;API,Horaires,Temps réel;https://www.digital.sncf.com/startup/API/conditions-generales-dutilisation-de-lapi-sncf;fr;;2023-04-17;;2023-04-17;SNCF;;;;;;;;;Temps réel;;;;;;;Irrégulière;0;True;
archives-sncf-sardo;False;Archives SNCF;"Le Service Archives Documentation du Groupe SNCF présente son jeu de données Archives. Afin de refléter au mieux la richesse et la diversité des
fonds conservés, cette base de données recense des archives historiques
numérisées issues de toutes les périodes de l’histoire de la SNCF depuis la
création du chemin de fer en FrancePlus de 12.500 dossiers sont présentées dans ce jeu de
données. Tous ces documents sont consultables sur le site https://www.archives.sncf.com grâce
à un moteur de recherche performant.
Le volume
d’archives disponible mis en ligne sera enrichi régulièrement avec de nouvelles
thématiques.";Archives et documentation,Patrimoine;Archives,Service Archives Documentation,Transparence;Open Database License (ODbL);fr;;2023-12-21;2023-12-21;2023-12-24;SNCF;;;;;;;;;;;;;;;;Irrégulière;12447;True;
archives-sncf-new;False;Archives SNCF - OPEN ARCHIVES;Liste des archives SNCF disponibles sous un format numérique.   Cette base de données recense des archives historiques numérisées issues de toutes les périodes de l’histoire de la SNCF depuis la création du chemin de fer en France. Différents types de documents média (JPG, WAV, PDF, ou .MP4) sont proposés au téléchargement. Leur utilisation est soumise au respect des CGU du site sncf.com;Archives et documentation;Voyageurs,Histoire,Gare de voyageurs,Archives;Open Database License (ODbL);fr;;2023-07-06;2023-07-06;2023-10-09;SNCF;;;;;;;;;;;;;;;;Irrégulière;2586;True;
attente-au-guichet;True;Attente en espace de vente;Ce jeu de données recense le nombre quotidien de personnes ayant attendu plus de 30 minutes et plus de 60 minutes dans les espaces de vente de grandes gares SNCF (Paris Gare de Lyon, Paris Gare de l’Est, Paris Gare du Nord, Paris Saint Lazare, Bordeaux, Strasbourg).  La données est issue des automates distributeurs de ticket d’attente.  Le temps d’attente à l’extérieur de l’espace de vente n’est pas mesuré actuellement. Les équipes SNCF travaillent activement à cette mesure.  Le projet étant en cours de déploiement, d’autres grandes gares Françaises vont être ajoutées à partir de mi-juillet 2020. Paris Montparnasse, qui dispose d'un outillage différent des autres gares, sera de retour fin août.  Les données sont communiquées de manière hebdomadaire (le mercredi). Nous travaillons également à un mode de fourniture temps réel.;Comptage et flux;;Open Database License (ODbL);fr;;2024-06-14;2024-06-14;2024-08-02;SNCF Voyageurs;;Logiciel QMATIC;;;;;;;;;;;;;;Hebdomadaire;45311;True;En retard
autres-charges-externes-2017-cco;True;Autres charges externes CCO du groupe SNCF Réseau depuis 2015;Autres charges externes depuis 2015 issues du Rapport Financier du groupe SNCF Réseau au 31 décembre de chaque année (Comptes consolidés incluant l'EPIC SNCF RESEAU et ses filiales);Réseau;SNCF RESEAU,Comptes Consolidés,Charges,Autres Charges Externes;Open Database License (ODbL);fr;;2022-03-24;2021-07-01;2024-01-10;SNCF Réseau;;;;;;;;;;;;;;;;Annuelle;7;True;En retard
autres-charges-externes-2017-cso;True;Autres charges externes CSO de SNCF Réseau depuis 2015;Autres charges externes depuis 2015 issues du Rapport Financier du groupe SNCF Réseau au 31 décembre de chaque année (Comptes sociaux de l'EPIC SNCF RÉSEAU);Réseau;SNCF RESEAU,Comptes Sociaux,Autres Charges Externes;Open Database License (ODbL);fr;;2022-03-24;2021-07-01;2024-01-10;SNCF Réseau;;;;;;;;;;;;;;;;Annuelle;7;True;En retard
avantages-au-personnel-2017-cco;True;Avantages au personnel CCO du groupe SNCF Réseau depuis 2015;Avantages au personnel depuis 2015 issus du Rapport Financier du groupe SNCF Réseau au 31 décembre de chaque année (Comptes consolidés incluant l'EPIC SNCF RESEAU et ses filiales);Réseau;SNCF RESEAU,Comptes Consolidés,avantages,personnel,avantages au personnel;Open Database License (ODbL);fr;;2022-03-24;2021-07-01;2024-01-10;SNCF Réseau;;;;;;;;;;;;;;;;Annuelle;13;True;En retard
barometre-notes-dopinion-sncf-gmv;False;Baromètre notes d'opinion SNCF de janvier 2018 à décembre 2021 (GMV);Ce jeu de données recense les notes d'opinion attribuées à la SNCF pour ses services. A partir de janvier 2018, la SNCF a opté pour un nouvel outil de mesure de l’ Image afin d’en améliorer la fiabilité, la cohérence-comparabilité et l’interprétation.  Jusqu’au 31 décembre 2017, deux questionnaires différents étaient soumis chaque mois à deux échantillons différents, les Français d’une part, les clients d’autre part. L’enquête était menée par IPSOS (Institut de sondage français).  A partir du 1er janvier 2018, un questionnaire unique, online, est soumis chaque mois, à un même échantillon (1000 Français représentatifs de la population française de plus de 15 ans, dont environ 400 « clients »,personnes ayant utilisé la SNCF dans les 12 derniers mois). L’enquête est menée par l’Institut de conseil GMV.  Toute utilisation de ces données doit tenir compte de la rupture d'historique occasionnée.  Les indicateurs  Pour chaque indicateur, les résultats sont fournis pour les Français,  pour les clients (personnes ayant utilisé la SNCF dans les 12 derniers mois) et par différence pour les Non clients  1/ Réputation (ou note d’opinion globale sur 10)  Question : Quelle note d'opinion entre 0 et 10 donneriez-vous à la SNCF, en fonction de l'opinion générale que vous en avez ?   2/ Ponctualité   Question :  Parlons de la SNCF, en tant qu’opérateur de transport et de sa relation avec ses clients… - A des trains qui partent et arrivent à l'heure   3/ Prix   Question :Parlons de la SNCF, en tant qu’opérateur de transport et de sa relation avec ses clients… - Propose des produits et services qui ont un bon rapport qualité-prix   4/ Information Voyageurs :   Question : Parlons de la SNCF, en tant qu’opérateur de transport et de sa relation avec ses clients… - Informe efficacement ses clients en cas de perturbations  5/ Innovation  Question : Parlons de l’innovation et du développement à la SNCF… - Innove pour proposer des solutions de mobilité écologiques;Marque et communication externe;Image SNCF,Opinion,Baromètre d'image,Marque;Open Database License (ODbL);fr;;2023-06-08;2023-06-08;2023-06-08;SNCF;;;;;;;;;Mensuelle;;2018-01-01/2021-12-31;;;;;Irrégulière;283;True;
sncf-image-open-data-mensuel-harris;False;Baromètre notes d'opinion SNCF depuis janvier 2022 (Harris Interactive);Ce jeu de données est issu du baromètre image de la SNCF qui mesure l’opinion des Français sur la SNCF selon les 5 indicateurs suivants :  l’opinion globale, la perception de la ponctualité, du prix, de l’innovation, de l’information voyageurs et de l’engagement environnemental de la SNCF. En janvier 2022, la SNCF a fait évoluer le questionnaire et pose uniquement des questions sur une échelle sémantique. Ainsi, elle ne diffuse plus une note moyenne sur 10, mais un pourcentage d’opinions favorables. Toute utilisation de ces données doit tenir compte de la rupture d’historique occasionnée. Ce questionnaire est administré chaque mois, par mail, à 1000 Français sur la base d’un échantillon représentatif national. La SNCF a mandaté l’institut de sondage indépendant Harris Interactive pour la réalisation de ce baromètre.   Les indicateurs : Opinion globale Quelle opinion générale avez-vous de La SNCF ? Très bonne opinion / Plutôt bonne opinion / Plutôt mauvaise opinion / Très mauvaise opinion /Ne se prononce pasPourcentage donné : Très bonne opinion + plutôt bonne opinion Ponctualité Êtes-vous d’accord ou non avec la phrase… La SNCF a des trains qui partent et arrivent à l’heure  Tout à fait d’accord / Plutôt d’accord / Plutôt pas d’accord / Pas du tout d’accord / Ne se prononce pas  Pourcentage donné : Tout à fait d’accord + plutôt d’accord Prix Êtes-vous d’accord ou non avec la phrase… La SNCF propose des tarifs qui permettent à tous de voyager Tout à fait d’accord / Plutôt d’accord / Plutôt pas d’accord / Pas du tout d’accord / Ne se prononce pas Pourcentage donné : Tout à fait d’accord + plutôt d’accord Innovation Êtes-vous d’accord ou non avec la phrase… La SNCF est une entreprise innovante Tout à fait d’accord / Plutôt d’accord / Plutôt pas d’accord / Pas du tout d’accord / Ne se prononce pas Pourcentage donné : Tout à fait d’accord + plutôt d’accord Information voyageurs Êtes-vous d’accord ou non avec la phrase… La SNCF Informe bien ses clients avant, pendant et après leur voyage Tout à fait d’accord / Plutôt d’accord / Plutôt pas d’accord / Pas du tout d’accord / Ne se prononce pas Pourcentage donné : Tout à fait d’accord + plutôt d’accord Environnement Êtes-vous d’accord ou non avec la phrase… La SNCF Propose des modes de transport respectueux de l'environnement Tout à fait d’accord / Plutôt d’accord / Plutôt pas d’accord / Pas du tout d’accord / Ne se prononce pas Pourcentage donné : Tout à fait d’accord + plutôt d’accord;Marque et communication externe;Image SNCF,Baromètre d'image,Opinion,Marque;Open Data Commons Open Database License (ODbL);fr;;2023-09-25;2023-09-25;2023-09-25;SNCF;;;2022-11-16;;;;;;;;;;;;;Mensuelle;120;True;En retard
barometre-notes-dopinion-sncf;False;Baromètre notes d'opinion SNCF jusqu'au 31/12/2017 (IPSOS);Ce jeu de données recense les notes d'opinion attribuées à la SNCF pour ses services. Elles sont issues  des enquêtes menées par IPSOS (Institut de sondage français) auprès de la population nationale représentée par deux échantillons comprenant d'une part les français (volet réputation) et d'autre part les clients (volet Expérience Marque).;Marque et communication externe;Image SNCF,Opinion,Baromètre d'image,Marque;Open Database License (ODbL);fr;;2023-06-08;2023-06-08;2023-06-08;SNCF;;;;;;;;;;;2014-04-01/2017-12-31;;;;;Irrégulière;180;True;
barometre-client;False;Baromètre satisfaction client en gare;"Le baromètre de satisfaction client en gare est l’outil principal de mesure de la qualité perçue de SNCF Gares & Connexions. Les clients sont interrogés en face à face en gare et notent la gare de 0 à 10 autour des 7 promesses de service :  Promesse 1 : les informationsPromesse 2 : les déplacementsPromesse 3 : la propreté et la      sûretéPromesses 4 : le confort de l'attentePromesse 5 : les commerces et      les servicesPromesse 6 : l’architecture et les
animationsPromesse 7 : la mobilité durable     Ces mesures sont réalisées dans les 130 plus grandes gares avec une fréquence de 2 vagues annuelles en mars et en septembre.";Gares;Satisfaction client,Gare de voyageurs,Service en gare;Open Database License (ODbL);fr;;2023-06-30;;2023-06-30;Gares & Connexions;;;2015-05-12;2015-05-12;Gares & Connexions;;;;Semestriel;;;Gares de France;;;;Semestrielle;0;True;En retard
bfr-exploitation-2017-cco;True;BFR exploitation CCO du groupe SNCF Réseau depuis 2015;BFR exploitation depuis 2015 issus du Rapport Financier du groupe SNCF Réseau au 31 décembre de chaque année (Comptes consolidés incluant l'EPIC SNCF RESEAU et ses filiales);Réseau;SNCF RESEAU,Comptes Consolidés,BFR,Exploitation;Open Database License (ODbL);fr;;2022-03-24;2021-06-29;2024-01-10;SNCF Réseau;;;;;;;;;;;;;;;;Annuelle;30;True;En retard
bilan-actif-2017-cco;True;Bilan actif CCO du groupe SNCF Réseau depuis 2015;Bilan actif depuis 2015 issu des Rapports Financiers du groupe SNCF Réseau au 31 décembre de chaque année (Comptes consolidés incluant l'EPIC SNCF RESEAU et ses filiales).;Réseau;SNCF RESEAU,Comptes Consolidés,Bilan,Actif;Open Database License (ODbL);fr;;2022-03-24;2021-06-29;2024-01-10;SNCF Réseau;;;;;;;;;;;;;;;;Annuelle;14;True;En retard
bilan-actif-2017-cso;True;Bilan actif CSO de SNCF Réseau depuis 2015;Bilan actif depuis 2015 issu du Rapport Financier du groupe SNCF Réseau au 31 décembre de chaque année (Comptes sociaux de l'EPIC SNCF RÉSEAU);Réseau;SNCF RESEAU,Comptes Sociaux,Bilan,Actif;Open Database License (ODbL);fr;;2022-03-24;2021-07-01;2024-01-10;SNCF Réseau;;;;;;;;;;;;;;;;Annuelle;108;True;En retard
bilan-passif-2017-cco;True;Bilan passif CCO du groupe SNCF Réseau depuis 2015;Bilan passif depuis 2015 issu des Rapports Financiers du groupe SNCF Réseau au 31 décembre de chaque année (Comptes consolidés incluant l'EPIC SNCF RESEAU et ses filiales).  Les notes 1 à 11   font partie intégrante des comptes consolidés annuels.;Réseau;SNCF RESEAU,Comptes Consolidés,Bilan,Passif;Open Database License (ODbL);fr;;2022-03-24;2021-06-29;2024-01-10;SNCF Réseau;;;;;;;;;;;;;;;;Annuelle;21;True;En retard
bilan-passif-2017-cso;True;Bilan passif CSO de SNCF Réseau depuis 2015;Bilan passif depuis 2015 issu du Rapport Financier du groupe SNCF Réseau au 31 décembre de chaque année (Comptes sociaux de l'EPIC SNCF RÉSEAU);Réseau;Comptes Sociaux,SNCF RESEAU,Bilan,Passif;Open Database License (ODbL);en;;2022-03-24;2021-07-01;2024-01-10;SNCF Réseau;;;;;;;;;;;;;;;;Annuelle;22;True;En retard
